productId,title,visionCategoryName,stock
68426,Vestido Tricot Listras Multicolorido - P,Vestidos,True
148091,Mochila Xodó Farm Férias na Praia Azul,Outras,True
81959,Mini Saia Balone Foil Prata - M,Saias,True
71169,Calça Crochet Estampada Abacatua Est Abacatua_Amarelo Sicilia - G,hold,True
78599,Sandália Rasteira Slipper Preto - 44,Rasteiras,True
84757,Boné Tropical Férias Na Praia Off White - U,Outras,True
149991,Tênis Chamego Caracol Caracol Off White - 35,Tenis,True
76130,Saia Estampada Arraia Poá Arraia Poa_Off White - G,Saias,True
78744,Vestido Pull Estampado Copabanana Azul Catavento Est Copabanana_Azul Catavento @ - GG,Vestidos,True
75235,Calça Trançada Lateral Verde Cardo - PP,hold,True
74923,Short Degrau Jeans Desfiado Jeans - 36,hold,True
77561,Saia Sarja Festonê Off White - 42,Saias,True
149782,Tênis Av Mid Tratorado Carnaval Das Águas - 36,Tenis,True
83766,Jaqueta Jeans Cropped Jeans Claro - G,Jaquetas,True
83982,Top Tricot Corselet Bege Cris - G,Tops,True
72423,Top Adidas Estampado Boho Flower Royal Azul Escuro - M,Tops,True
69622,Jaqueta Gola Sarja Azul Caribe - PP,hold,True
74160,Camisa Irregular Bolso Amarelo Carambola - P,Camisa,True
79965,Blusa Estampada Lenço Floral Biribá Lenco Floral Biriba_Preto - PP,Blusa,True
71549,Luva Penduricalho Amô Amô Pimenta Rosa - PP,Outras,True
71366,Maiô Localizado Estampado Canteiro De Flor Canteiro Floral_Loc Maio Praia_Rosa Chi - GG,hold,True
148661,Macacão Estampado Lenço Floraline Lenco Floraline_Off White - PP,Macacão,True
75900,Vestido Cropped Estampado Shuhu Shuhu_Marrom Pinhal - G,Vestidos,True
77589,Calça Estampada Sapos Coloridos Est Sapos Coloridos_Preto @ - PP,hold,True
80366,Short Moletom Estampado Tigre Da Noite Tigre Da Noite_Marrom Terra - G,Shorts,True
154300,Body Saia Bebe Silk Rosa Cicleman - 12M,Body,True
76861,Jaqueta Estampada Mata Tropical Mata Tropical_Bege Sertao - GG,Jaquetas,True
148302,Blusa Estampada Rendeira Est Rendeira_Amarelo Nectar @ - G,Blusa,True
79573,Blazer Estampado Arara Cobogó Arara Cobogo_Vermelho Jaspe - M,Blazers,True
155187,Macaquinho Bebe Malha Blim Blim Est Blim Blim Fundo Off% - 6M,Macacão,True
78761,Blusa Romântica Bordada Lilas Azaleia - M,Blusa,True
83216,Regata Farmrio Banana Off Off White - M,Blusa,True
78059,Top Cropped Adidas Manga Longa Logomania Azul Escuro - M,Tops,True
76861,Jaqueta Estampada Mata Tropical Mata Tropical_Bege Sertao - G,Jaquetas,True
72431,Maiô Adidas Estampado Floral Stripes Red Rosa - M,Outras,True
78762,Blusa Romântica Bordada Off White - G,Blusa,True
154727,Short Malha Jacarinho Est Jacarinho Fundo Rosa Ciclamen% - 2,Shorts,True
82796,Vestido Cropped Estampado Lago Dos Cisnes Lago Dos Cisnes_Verde Salvia - GG,Vestidos,True
81427,Vestido Curto Marias Marinho Sodalita - M,hold,True
75643,Top Lastex Estampado Araras Araras_Rosa Mosqueta - GG,hold,True
83715,Sand Clog Verde - 39,Sandálias,True
74013,T-Shirt Cropped Básica Preto - P,hold,True
84126,Calça Sarja Loose Bisne Bege Aveia - 36,Calças,True
71918,Saia Recortes Metabrilho Laranja Mamao - PP,hold,True
148036,Short Jacquard Atoalhado Purga - P,Shorts,True
82822,Vestido T-Shirt Básico Estampado Doce Caminho Doce Caminho_Off White - P,Vestidos,True
75236,Calça Trançada Lateral Laranja Kino - PP,hold,True
77449,Blusa Lastex Estampada Floral Lumi Floral Lumi_Verde Sagu - P,Blusa,True
154726,Jardineira Bebe Fila De Peixe Est Cais Fundo Off - 12M,Macacão,True
77232,Blazer Estampado Pose Surreal Pose Surreal_Roxo Fada - G,Blazers,True
84381,Vestido Longo Estampado Lenço Floraline Lenco Floraline_Off White - M,Vestidos,True
79451,Vestido Básico Rib Preto - M,Vestidos,True
81566,Calça Ampla Pregas Preto - P,Calças,True
149852,Tênis Rua Ii Mid Branco - 38,Tenis,True
149973,Tênis Avenida Tratorado Iate Magia Tropical - 37,Tenis,True
84427,Calça Pantalona Estampada Chita Bella Est Chita Bella Barrado_Bege Macrame @ - GG,Calças,True
78147,Calça Estampada Bossa Banana Bossa Banana_Rosa Amor - PP,Calças,True
80392,Camisa Uni Estampada Máscaras Encantadas Est Mascaras Encantadas_Verde Gomeira @ - XG,Camisa,True
81764,Cardigan Tricot Pelinho Amarelo Cevada - M,Cardigan,True
148213,Pochete Farmete Farm Onça Cool,Outras,True
80906,Mini Saia Balone Foil Dourado - P,Saias,True
78458,Camisa Estampada Jardim Romance Jardim Romance_Preto - G,Camisa,True
67457,Conjunto Patch Paetê Multicolorido - PP,Outras,True
71363,Saída De Praia Estampada Que Onda Que Onda_Praia_Bege Cupuacu - GG,hold,True
81535,Calça Reta Pregas Rosa Flamboyant - M,Calças,True
76130,Saia Estampada Arraia Poá Arraia Poa_Off White - P,Saias,True
83319,Vestido Cropped Estampado Janelas Do Cerrado Janelas Do Cerrado_Bege Macrame - P,Vestidos,True
152079,Mochila Borogodó Delicata Delicata - U,Outras,True
84528,Short Estampado Nanica Nanica_Off White - P,Shorts,True
84382,Regata Lenço Estampada Noite Dos Cisnes Est Noite Dos Cisnes_Azul Veneza @ - M,Blusa,True
78556,Vestido Crf Farm Vermelho - P,Vestidos,True
68229,Adilette Adidas Sunny Palm Lilás Multicolorido - 36 37,Outras,True
83137,Camisa Estampada Quadriculado De Sonho Quadriculado Sonho_Off White - G,Camisa,True
73581,Vestido Cropped Estampado Bossa Banana Bossa Banana_Rosa Amor - M,Vestidos,True
75181,Short Saia Pregas Verde Cardo - GG,Shorts,True
78032,Havaianas Estampadas Biribá Off Amarelo Est Biriba_Off White @ - 35 36,Sandálias,True
75026,Blusa Cropped Estampada Kauai Est Kauai_Multicolorido @ - PP,hold,True
83091,Blusa Estampada Doce Caminho Doce Caminho_Off White - P,Blusa,True
75189,Regata Degagê Alcinha Verde Cardo - G,Blusa,True
149992,Bota Chelsea Cano Alto Preto - 39,Botas,True
75501,Sandália Salto Anabela Amarelo - 39,hold,True
73641,Camisa Estampada Coqueiral Coqueiral_Rosa Biju - GG,Camisa,True
78601,Sandália Rasteira Slipper Lilas - 35,Rasteiras,True
154701,Calca Moletom Beirinha Est Beirinha Fundo Off ] - 2,Calças,True
84382,Regata Lenço Estampada Noite Dos Cisnes Est Noite Dos Cisnes_Azul Veneza @ - G,Blusa,True
152053,Praiana Velcro Duplo Passadena Onça - 35 36,Rasteiras,True
71349,Maiô Artesanal Estampado Groove Tropical Tropical Groove_Maio Praia_Verde Kiwi - P,hold,True
73925,Top Estampado Jardim De Verão Jardim De Verao_Amarelo Milho - PP,hold,True
152087,Tênis Pista Maia - 38,Tenis,True
77786,Camisa Uni Estampada Folhagem De Banana Multicolorido - M,Camisa,True
75265,Calça Cenoura Pregas Preto - P,Calças,True
84147,Calça Alfaiataria Cotelê Caramelo - 44,Calças,True
78256,Calça Pregas Frente Azul Atlantico - M,Calças,True
72359,Mini Saia Sarja Estampada Búzios Caramelo - 36,Saias,True
84545,Vestido Curto Estampado Thalía Thalia_Multicolorido - PP,Vestidos,True
81277,Moletom Cutwork Flor Multicolorido - PP,Outras,True
74427,Short Recortes Frente Amarelo Carambola - M,hold,True
84522,Vestido Cropped Estampado Nanica Nanica_Off White - G,Vestidos,True
83364,Vestido Midi Estampado Paisagem De Sonho Paisagem De Sonho_Azul Mirante - P,Vestidos,True
80101,Body Estampado Aquarela Tropical Aquarela Tropical_Bege Barbante - PP,Body,True
79408,Blusa Estampada Calor Floral Est Calor Floral_Rosa Bruma @ - P,Blusa,True
66295,Top Estampado Vitamina De Banana Est Vitamina De Banana_Off White - GG,hold,True
55264,Mule Sonho De Verão Palha - 38,Tamancos,True
82707,Vestido Barrado Estampado Brilho Tropical Brilho Tropical_Azul Netuno - PP,Vestidos,True
75682,Blazer Curto Estampado Lembrança De Verão Banana Lembranca De Verao Banana_Off White - PP,Blazers,True
72156,Blusa Double Estampada Flor De Renda Est Floral De Renda_Azul Patacho @ - P,hold,True
68232,Tênis Adidas Court Silk All Together Pastel Multicolorido - 34,Tenis,True
74923,Short Degrau Jeans Desfiado Jeans - 46,hold,True
148148,Bolsa Tote Praiana Farm Rio de Flor Azul,Outras,True
74049,Maiô Estampado Noite De Coqueiro Est Noite De Coqueiro_Biquini Praia_Pret - G,hold,True
81567,Calça Ampla Pregas Bege Alpaca - M,Calças,True
75199,Blusa Cropped Básica Roxo Berinjela - PP,hold,True
72896,Camisa Manga Bufante Cetim Laranja Cenoura - GG,hold,True
73142,Short Saia Estampado Tucano Onça Est Tucano Onca_Preto - GG,Shorts,True
81634,Calça Estampada Alegria Alegria_Off White - G,hold,True
74417,Top Concha Alcinhas Amarelo Carambola - G,hold,True
65020,Top Bela Est Bela_Decorado_Branco Magia @ - G,Tops,True
80910,Calça Legging Metalizado Prata Chumbo - G,Calças,True
74188,Regata Cropped Cetim Azul Bertioga - GG,hold,True
148057,Saia Longa Fenda Black Jeans Black Jeans - 42,Saias,True
73943,Top Estampado Bronzeado Bronzeado_Rosa Gandaia - GG,hold,True
79491,Tênis Nave Preto - 36,Tenis,True
149932,Tênis Rua Ii Preto - 36,Tenis,True
80621,Camisa Algodao Basica Verde Figueira - GG,Camisa,True
148882,Regata Farmrio Onça Preto Preto - M,Blusa,True
150549,Colete a Brasileira Off White - GG,Outras,True
79730,Calça Jeans Skinny Clara Jeans Claro - 42,Calças,True
80078,Regata Estampada Romance Romance_Verde Amazonita - M,hold,True
80389,Blusa Golinha Folia Preto - PP,Blusa,True
77554,Short Jeans Baggy Jeans Medio - 40,Shorts,True
73226,Calça Cintura Baixa Bordada Lembrança De Verão Multicolorido - GG,Calças,True
77896,Calça Pantalona Estampada Listra Rainbow Listra Rainbow_Multicolorido - G,Calças,True
73635,Top Estampado Coqueiral Coqueiral_Rosa Biju - GG,hold,True
75597,Blusa Cropped Estampada Flor De Antúrio Flor De Anturio_Azul Aruba - P,hold,True
77669,Blusa Bata Amarração Estampada Alba Alba_Azul Recife - PP,Blusa,True
77558,Calça Black Jeans Hotfix Black Jeans - 36,Calças,True
76192,Saia Estampada Caminho Yawanawa Caminho Yawanawa_Preto - PP,Saias,True
76275,Vestido Bordado Surreal Multicolorido - G,Vestidos,True
80870,Calça Recorte Sarja Off Off White - 44,Calças,True
80510,Calça Jeans Utopia Jeans - 34,Calças,True
84868,Toalha Tchibum Rio De Flor Off White - U,Outras,True
80505,Corselet Black Jeans Sem Alça Black Jeans - P,Blusa,True
80552,Macacão Estampado Arara Cobogó Arara Cobogo_Azul Netuno - P,Macacão,True
154729,Blusa Malha Jacarinho Rosa Est Jacarinho Fundo Rosa Ciclamen% - 10,Blusa,True
82826,Camisa Meio a Meio Estampada Banana Sketch Est Banana Sketch_Preto - P,Camisa,True
77788,Bermuda Estampada Tucano Rainbow Multicolorido - GG,hold,True
78244,Blazer Kimono Detalhe Amarelo Nectar - GG,Blazers,True
155549,Vestido Amor De Flor Est Amor De Flor Fundo Off% - 4,Vestidos,True
154701,Calca Moletom Beirinha Est Beirinha Fundo Off ] - 6,Calças,True
81958,Casaco Desejo Verde Jabuti - PP,Jaquetas,True
72134,Regata Alcinhas Plissado Azul Bertioga - G,hold,True
152021,Tênis Avenida Tratorado Iate Selvática - 35,Tenis,True
79023,Calça Guipure Amor De Abacaxi Multicolorido - P,Calças,True
148798,Vestido Lastex Estampado Jade Jade_Lilas Brunela - PP,Vestidos,True
81766,Calça Tricot Estampada Tambaqui Est Tropicaxi_Verde Absinto - P,Calças,True
75685,Blusa Double Estampada Lembrança De Verão Lembranca De Verao Banana_Off White - PP,hold,True
82720,Short Estampado Camafeu Tropical Est Camafeu Tropical_Off White - M,Shorts,True
84456,Vestido Cropped Estampado Cecília Est Cecilia_Rosa Livia - G,Vestidos,True
78682,Pull Tricot Pelinho Estampado Flor Est Flor_Multicolorido - GG,Suéter,True
150549,Colete a Brasileira Off White - P,Blusa,True
77086,Calça Estampada Beijo Beijo_Azul Ubatuba - P,hold,True
68072,Top Jeans Borboleta Jeans - GG,hold,True
154303,Camiseta Silk Tabatinga Areia Taua - 4,Camisetas,True
82657,Bata Estampada Floral Sofia Floral Sofia_Off White - G,Blusa,True
75752,Top Estampado Paisley Onça Est Paisley Onca_Bege Cupuacu - GG,hold,True
76457,Calça Estampada Awavena Maxi Est Awavena Maxi_Marrom Cocar - P,Calças,True
148566,Bermuda Jeans Baggy Baixa Jeans Medio - 34,Shorts,True
62469,Body Peixes Azul Skyblue - GG,Body,True
56845,Maiô Bojo Lastex Sonho De Limão Est Sonho De Limao_Mini Praia_Lilas Luar - PP,hold,True
71246,Lenço Praia Estampado Listra Coração Est Listra Coracao_Rosa Astromelia - M,hold,True
82732,Blazer Estampado Camafeu Tropical Est Camafeu Tropical_Off White - M,Blazers,True
148841,Vestido Curto Estampado Lenço Madri Lenco Madri_Verde Amazonita - P,Vestidos,True
71510,Blusa Estampada Aquarela Floral Aquarela Floral_Mini_Azul Mykonos - G,hold,True
51651,Lenço Maxi Harmonia Multicolorido - U,Outras,True
64226,Top Biquíni Tricot Amarração Dourado - GG,hold,True
78207,Body Nó Rosa Granita - P,Body,True
69078,Blusa Gola Tule Vermelho Oeste - PP,hold,True
83482,Vestido Curto Estampado Floral Erika Floral Erika_Rosa Pantai - G,Vestidos,True
74192,Blusa Cropped Estampada Floral Magia Floral Magia Corrido_Amarelo Pajura - PP,hold,True
78668,Jaqueta Recortes Estampada Esplendor Tropical Deco Est Esplendor Tropical Decorado_Roxo Ala - PP,Jaquetas,True
78015,Macacão Cropped Saruel Estampado Amazônia Preto - P,Macacão,True
69152,Calça Cenoura Bolsos Laterais Bege Jalapao - M,hold,True
148280,Pochete Dengo Farm Tucano em Flor,Outras,True
69619,Flower Thong Sandal Prata Velha - 43,hold,True
84044,Short Bolso Alfaiataria Laranja Ponca - P,Shorts,True
74613,Vestido Cropped Vazado Verde Cardo - G,hold,True
84006,Regata Cropped Rita Preto - G,Blusa,True
148172,Bolsa Findi Borogodó Farm Aquarela Floral,Outras,True
71729,Macaquinho Tricot Estampado Que Onda Que Onda_Bege Cupuacu - G,hold,True
148818,Vestido Sem Manga Estampado Milani Milani_Off White - M,Vestidos,True
80332,Vestido Midi Estampado Persa Persa_Azul Carbono - GG,Vestidos,True
67727,Body Laminado Estampado Tarde De Inverno Est Tarde De Inverno_Macaquinho Praia_Mu - G,Body,True
79534,Tênis Avenida Tratorado Mid Jardim Classico Preto - 39,Tenis,True
77788,Bermuda Estampada Tucano Rainbow Multicolorido - M,hold,True
81822,Vestido Pull Tricot Pelinho Rendeira Est Milani_Off White - P,Vestidos,True
80938,Calça Estampada Copabanana Est Copabanana_Azul Catavento @ - M,Calças,True
80439,Blusa T-Shirt Com Ombreira Removível Preto - PP,Blusa,True
65131,Sand Rast Pelo Miçangas Verde Selva - 35,hold,True
65135,Sand Puffer Céu Do Cerrado Est Ceu Do Cerrado Corrida_Preto @ - 36,hold,True
152070,Tênis Pista Selvática - 37,Tenis,True
148088,Mochila Borogodó Farm Férias na Praia Azul,Outras,True
73098,Top Estampado Selva Urbana Est Selva Urbana_Vermelho Hibisco - PP,hold,True
84113,Vestido Longo Plissado Estampado Listra Fernanda Est Listra Fernanda_Rosa Buque - G,Vestidos,True
83107,Vestido Midi Estampado Samambaia Est Samambaia_Off White @ - GG,Vestidos,True
80450,Calça Cargo Sarja Verde Verde Musgo - 44,Calças,True
72290,Short Jeans Cós Virado Jeans - 42,Shorts,True
80305,Casaco Capuz Estampado Folhagem De Banana Est Folhagem De Banana_Multicolorido @ - PP,hold,True
76874,Vestido Cropped Estampado Floresta De Caju Floresta De Caju_Bege Saibro - GG,Vestidos,True
78028,Havaianas Estampadas Leveza Tropical Est Leveza Tropical_Azul Ilhabela @ - 43 44,Sandálias,True
148910,Vestido Decote Regata Rib Preto - M,Vestidos,True
62557,Sand Anat Lagoa Gomos Crochet Sunny Day Multicolorido - 34,hold,True
81512,Casaco Capuz Estampado Jardim Encantado Est Jardim Encantado_Preto - GG,Outras,True
149992,Bota Chelsea Cano Alto Preto - 37,Botas,True
149933,Tênis Pista Caramelo - 37,Tenis,True
84712,Tn Avenida Tratorado Pink - 36,Outras,True
74858,Saia Sarja Listra Neon Listra Floral Neon_Sarja_Multicolorido - 46,hold,True
73645,Calça Estampada Coqueiral Coqueiral_Rosa Biju - G,hold,True
73914,Camisa Estampada Selva Doce Selva Doce_Vermelho Caiena - G,hold,True
80717,Calça Plissada Estampada Mergulho De Sonho Est Mergulho De Sonho_Multicolorido - M,Calças,True
83554,Regata Estampada Floral Solar Floral Solar_Amarelo Astral - PP,Blusa,True
71557,Macacão Bossa Banana Est Bossa Banana_Macacao Praia_Preto - G,Macacão,True
83106,Body Estampado Ravenala Ravenala_Off White - PP,Body,True
82710,Vestido Midi Estampado Brilho Tropical Brilho Tropical_Off White - G,Vestidos,True
149187,T-Shirt Cropped Estampada Festa De Caju Festa De Caju_Preto - M,Camisetas,True
82651,Vestido Curto Estampado Jardim Encantado Jardim Encantado_Off White - G,Vestidos,True
77905,Biquíni Artesanal Flor Azulejo Branco - M,Biquini,True
84053,Calça Pantalona Pregas Off White - G,Calças,True
55264,Mule Sonho De Verão Palha - 36,Tamancos,True
69933,Calça Pantalona Pregas Frente Vermelho Aka - P,hold,True
83359,Calça Jeans Recorte Cós Elástico Jeans Claro - 46,Calças,True
77415,Calça Lurex Estampada Coqueirou Coqueirou_Bege Sertao - M,Calças,True
82813,Saia Reta Estampada Chapada Dos Veadeiros Est Chapada Dos Veadeiros_Bege Macrame @ - P,Saias,True
79944,Vestido T-Shirt Curto Estampado Delicadeza Floral Delicadeza Floral_Bege Macrame - P,Vestidos,True
83779,Vestido Mangas Pregas Lilas Salvia - GG,Vestidos,True
55066,Sandália Bordada Boi De Santa Fé Multicolorido - 39,hold,True
76385,Blazer Estampado Yuinahu Corrido Yuinahu Corrido_Marrom Galho - P,Blazers,True
83177,T-Shirt Média Colorido Por Natureza Verde Verde Cachoeira - P,Camisetas,True
79408,Blusa Estampada Calor Floral Est Calor Floral_Rosa Bruma @ - M,Blusa,True
78133,Top Meia Taça Rosa Granita - GG,Tops,True
73464,Sandália Meia Pata Veludo Preto - 37,hold,True
81834,Vestido Saia Tricot Estampado Paisagem De Sonho Est Paisagem De Sonho_Azul Mirante - M,Vestidos,True
77623,Biquíni Artesanal Estampado Gosto De Banana Est Gosto De Banana_Praia_Rosa Dengo - GG,Biquini,True
74164,Top Tricot Com Franja Off White - PP,hold,True
82822,Vestido T-Shirt Básico Estampado Doce Caminho Doce Caminho_Off White - GG,Vestidos,True
83674,Vestido Ombro Só Longo Off White - G,Vestidos,True
74878,Colete Jeans Bordado Peixe Paisley Jeans - P,Blusa,True
79907,Blusa Decote Mangoes Verde Figueira - P,Blusa,True
79927,Windbreaker Richilieu Estampada Fauna Fantástica Est Fauna Fantastica_Azul Maceio - PP,Jaquetas,True
71242,Lenço Praia Estampado Doha Est Doha_Rosa Topazio - PP,hold,True
148485,Macacão Estampado Tambaqui Decorado Tambaqui Decorado_Preto - PP,Macacão,True
84051,Blusa Corselet Manga Longa Off White - G,Blusa,True
77795,Camisa Uni Estampada Helicônia Multicolorido - PP,Camisa,True
80441,Vestido Tricot Estampado Mãos Dadas Est Maos Dadas_Multicolorido - M,Vestidos,True
83823,Short Jeans Mullet Jeans Medio - 34,Shorts,True
148302,Blusa Estampada Rendeira Est Rendeira_Amarelo Nectar @ - M,Blusa,True
78032,Havaianas Estampadas Biribá Off Amarelo Est Biriba_Off White @ - 39 40,Sandálias,True
75571,Havaianas Estampadas Chita Solar Est Chita Solar_Verde Thai - 43 44,Rasteiras,True
79817,Vestido Cropped Estampado Mistura De Bicho Mistura De Bicho_Multicolorido - P,Vestidos,True
76386,Calça Estampada Yuinahu Corrido Yuinahu Corrido_Marrom Galho - PP,Calças,True
74723,Regata Básica Rib Preto - G,Blusa,True
69878,Top Estampado Magia Florestal Decorado Est Magia Florestal_Decorado_Multicolori - G,hold,True
154636,Praiana Est Abacaxi Deco Abacaxi Deco Artesanal - 37 38,Outras,True
77786,Camisa Uni Estampada Folhagem De Banana Multicolorido - P,Camisa,True
84895,Bolsa Arpoador Floral Lee Artesanal Laranja - U,Outras,True
75236,Calça Trançada Lateral Laranja Kino - P,hold,True
62554,Tn Ginga Mule Est Pe De Coqueiro_Corrido Artesanal_Beg - 39,hold,True
154436,Tênis Avenida Tratorado Voo Doce - 35,Tenis,True
84134,Calça Plissada Estampada Paisagem De Sonho Corrida Cancelado-Paisagem De Sonho_Azul Mirante - P,Calças,True
84129,Calça Sarja Loose Bisne Verde Senecio - 42,Calças,True
149970,Bolsa Chuchu Peixes Pintados Peixes Pintados - U,Outras,True
149812,Tênis Av Mid Tratorado Estrelada Bordado - 37,Tenis,True
83979,Top Tricot Corselet Azul Krabi - M,Tops,True
154698,Vestido Malha Beirinha Est Beirinha Fundo Azul Cannes% - 8,Vestidos,True
84698,Praiana Est Carioca Off White - 35 36,Rasteiras,True
78146,Camisa Bolso Estampada Bossa Banana Bossa Banana_Rosa Amor - PP,Camisa,True
82724,Regata Decote v Estampada Rendeira Est Rendeira_Azul Caribe @ - M,Blusa,True
74852,Bermuda Sarja Estampada Maré De Sol Mare De Sol_Corrido Sarja_Preto - 40,hold,True
78458,Camisa Estampada Jardim Romance Jardim Romance_Preto - M,Camisa,True
75736,Regata Nó Estampada Flor De Borboleta Est Insetos Florais_Amarelo Vagalume - GG,Blusa,True
77875,Vestido Curto Estampado Folhagem Cool Folhagem Cool_Rosa Gandaia - G,hold,True
154698,Vestido Malha Beirinha Est Beirinha Fundo Azul Cannes% - 4,Vestidos,True
49176,Short Clochard Bainha Roxo Camu - 36,Shorts,True
73722,Blazer Estampado Mania De Caju Est Mania De Caju_Decorado_Rosa Maranta - PP,hold,True
74160,Camisa Irregular Bolso Amarelo Carambola - M,Camisa,True
75267,Calça Cenoura Pregas Laranja Kino - P,Calças,True
155547,Camiseta Silk Boca Do Jaca Azul Beirinha - 6,Camisetas,True
71240,Lenço Praia Estampado Flora Lee Est Flora Lee_Bege Cupuacu - G,hold,True
77443,Blusa Nesgas Estampada Biribá Biriba_Off White - M,Blusa,True
149765,Praiana Est Ráfia Verde Rafia Verde - 35 36,Outras,True
155554,Macaquinho Malha Jagaura Verde Est Jaguara Fundo Verde Mangue% - 4,Macacão,True
59509,Top Meia Taça v Vermelho Gerbera - P,hold,True
73151,Legging Vivo Recorte Estampada Onça Cool Est Onca Cool_Preto - PP,Calças,True
80439,Blusa T-Shirt Com Ombreira Removível Preto - PP,Camisetas,True
80627,Maxi Camisa Estampada Sussuarana Sussuarana_Off White - PP,Camisa,True
148920,Vestido Decote Regata Rib Off White - GG,Vestidos,True
80392,Camisa Uni Estampada Máscaras Encantadas Est Mascaras Encantadas_Verde Gomeira @ - GG,Camisa,True
76615,Cardigan Tricot Pelinho Estrelas Azul Recife - M,Cardigan,True
83894,Vestido Curto Alcinhas Off White - G,Vestidos,True
76861,Jaqueta Estampada Mata Tropical Mata Tropical_Bege Sertao - M,Jaquetas,True
81459,Blusa Alcinha Lastex Costas Roxo Beterraba - PP,Blusa,True
83177,T-Shirt Média Colorido Por Natureza Verde Verde Cachoeira - G,Camisetas,True
80938,Calça Estampada Copabanana Est Copabanana_Azul Catavento @ - PP,Calças,True
83885,Vestido Longo Mangas Listras Listra Vermelho Morango/Off White - PP,Vestidos,True
81436,Macacão Corselet Reto Preto - M,Macacão,True
149809,Mochila Xodó Revoada Tropical Revoada Tropical - U,Outras,True
77449,Blusa Lastex Estampada Floral Lumi Floral Lumi_Verde Sagu - M,Blusa,True
77070,Camisa Cutwork Peixe Azul Reino - P,Camisa,True
149981,Tênis Chamego Caracol Caracol Preto - 36,Tenis,True
84228,Vestido Curto Estampado Samambaia Est Samambaia_Off White @ - M,Vestidos,True
78564,T-Shirt Crf Farm Vermelho - G,Camisetas,True
81139,Top Cropped Adidas Manga Longa Logomania Verde Kiwi - G,Tops,True
78170,Regata Alça Fina Verde Figueira - G,hold,True
155228,Blusa Malha Frutaria Preto Est Frutaria Fundo Preto% - 8,Blusa,True
149882,Tênis Rua Ii Mid Preto - 37,Tenis,True
84456,Vestido Cropped Estampado Cecília Est Cecilia_Rosa Livia - P,Vestidos,True
154394,Bolsa Chuchu Floral Delicado Floral Delicado - U,Outras,True
154706,Vestido Bebe Bordado Florir Rosa Ciclamen - 18M,Vestidos,True
77914,Biquíni Meia Taça Estampado Beleza Boho Est Beleza Boho_Bege Cupuacu @ - P,Biquini,True
73595,Top Assimétrico Rib Off White - M,hold,True
83961,Camisa Tricot Franja Listra Solar Multicolorido - M,Camisa,True
84730,Sand Puff Flatform Rio De Flor - 37,Sandálias,True
155552,Short Florir Est Florir Fundo Preto% - 10,Shorts,True
72113,Calça Flare Cetim Verde Pilar - P,hold,True
83747,Vestido Reto Alcinhas Verde Relva - PP,Vestidos,True
73504,Calça Bolso Cropped Laranja Cenoura - GG,hold,True
155228,Blusa Malha Frutaria Preto Est Frutaria Fundo Preto% - 4,Blusa,True
83694,Vestido Longo Estampado Alice Off Alice_Off White - G,Vestidos,True
83231,T-Shirt Média Rio De Janeiro Preto - P,Camisetas,True
69893,Conjunto Corselet Flô Est Flo_Biquini Praia_Rosa Maranta - G,Outras,True
79953,Calça Bolsos Laterais Amarelo Nectar - M,Calças,True
75779,Blazer Alfaiataria Roxo Petunia - M,hold,True
152085,Bolsa Fervo Floral Encanto Floral Encanto - U,Outras,True
84116,Calça Pregas Reta Preto - PP,Calças,True
59509,Top Meia Taça v Vermelho Gerbera - G,hold,True
78059,Top Cropped Adidas Manga Longa Logomania Azul Escuro - GG,Tops,True
81137,Vestido Adidas Psychedelic Wave Verde Cod Disponivel - M,Vestidos,True
80450,Calça Cargo Sarja Verde Verde Musgo - 40,Calças,True
83364,Vestido Midi Estampado Paisagem De Sonho Paisagem De Sonho_Azul Mirante - GG,Vestidos,True
83593,Vestido Cropped Estampado Tambaqui Tambaqui_Preto - GG,Vestidos,True
61012,Mule Amarracao Xadrez Pitanga Xadrez Banana Preto - 38,hold,True
80482,Blusa Bata Estampada Jasmin Jasmin_Bege Macrame - PP,Blusa,True
80163,Macaquinho Blazer Estampado Cidade Maravilhosa Cidade Maravilhosa_Preto - G,Blazers,True
62593,Sand Patch Trio Lenço Multicolorido - 35,hold,True
78208,Vestido Cropped Nós Azul Atlântico - PP,Vestidos,True
81822,Vestido Pull Tricot Pelinho Rendeira Est Milani_Off White - G,Vestidos,True
77488,Calça Pantalona Estampada Folhagem Sketch Folhagem Sketch_Verde Aspargo - P,Calças,True
151995,Garrafa Glub Glub 500ml Cogumelo Silvest Cogumelo Silvestre - U,Outras,True
82698,Vestido T-Shirt Big Estampado Brilho Tropical Brilho Tropical_Azul Netuno - P,Vestidos,True
77980,Blazer Estampado Onça De Ouro Onca De Ouro_Bege Cupuacu - GG,hold,True
74245,Blusa Cropped Pregas Verde Cardo - PP,hold,True
81177,Meia Laço Preto - U,Outras,True
154696,Camisa Beirinha Est Beirinha Fundo Azul Cannes% - 4,Camisa,True
68175,Moletom Adidas Estampado In Movement Preto Multicolorido - P,Outras,True
154498,Mochila Xodó Ravenala Ravenala - U,Outras,True
58307,Arco Flor Patch Est Listra Legal_Off White @ - GG,Outras,True
71238,Lenço Praia Estampado Mania De Caju Azul Est Mania De Caju_Azul Patacho - PP,hold,True
149957,Toalha Tchibum Folhagem Cool Folhagem Cool - U,Outras,True
80283,Macacão Moletom Estampado Zebras Est Zebras_Preto @ - PP,Macacão,True
78179,T-Shirt Basica Verde Figueira - G,Camisetas,True
43285,Blusa Cropped Manga Tricot Brasil Multicolorido - PP,Blusa,True
148261,Bolsa Ginga Tapioca Farm Rio de Cor Patch,Outras,True
71729,Macaquinho Tricot Estampado Que Onda Que Onda_Bege Cupuacu - M,hold,True
68625,Top Corselet Vermelho Aka - PP,Tops,True
84513,Vestido Cropped Estampado Milani Milani_Off White - M,Vestidos,True
